{
  "$schema": "https://json-schema.org/draft/2020-12/schema",
  "title": "Target Visual State",
  "type": "object",
  "additionalProperties": false,
  "required": [
    "schema_version",
    "event_type",
    "session_id",
    "sequence",
    "audio_time_ms",
    "state_id",
    "preset_id",
    "visual_mode",
    "parameters"
  ],
  "properties": {
    "schema_version": {
      "const": "1.1"
    },
    "event_type": {
      "const": "visual.target_state"
    },
    "session_id": {
      "type": "string",
      "minLength": 1
    },
    "sequence": {
      "type": "integer",
      "minimum": 0
    },
    "audio_time_ms": {
      "type": "integer",
      "minimum": 0
    },
    "state_id": {
      "type": "string",
      "minLength": 1
    },
    "preset_id": {
      "type": "string",
      "minLength": 1
    },
    "visual_mode": {
      "type": "string",
      "minLength": 1
    },
    "parameters": {
      "type": "object",
      "required": [
        "particles",
        "motion",
        "lighting",
        "background"
      ],
      "properties": {
        "particles": {
          "type": "object",
          "additionalProperties": false,
          "required": [
            "color",
            "density",
            "size",
            "opacity"
          ],
          "properties": {
            "color": {
              "type": "string",
              "pattern": "^#[0-9A-Fa-f]{6}$"
            },
            "density": {
              "type": "integer",
              "minimum": 0
            },
            "size": {
              "type": "number",
              "minimum": 0
            },
            "opacity": {
              "type": "number",
              "minimum": 0,
              "maximum": 1
            }
          }
        },
        "motion": {
          "type": "object",
          "additionalProperties": false,
          "required": [
            "speed",
            "intensity"
          ],
          "properties": {
            "speed": {
              "type": "number",
              "minimum": 0
            },
            "intensity": {
              "type": "number",
              "minimum": 0
            }
          }
        },
        "lighting": {
          "type": "object",
          "additionalProperties": false,
          "required": [
            "color",
            "intensity",
            "bloom_strength"
          ],
          "properties": {
            "color": {
              "type": "string",
              "pattern": "^#[0-9A-Fa-f]{6}$"
            },
            "intensity": {
              "type": "number",
              "minimum": 0
            },
            "bloom_strength": {
              "type": "number",
              "minimum": 0
            }
          }
        },
        "background": {
          "type": "object",
          "additionalProperties": false,
          "required": [
            "color"
          ],
          "properties": {
            "color": {
              "type": "string",
              "pattern": "^#[0-9A-Fa-f]{6}$"
            }
          }
        }
      },
      "additionalProperties": true
    }
  }
}